"rt","chain","gloss","trialnum","response","clozeIndex","document","original","condition","age","comments","education","ethnicity","gender","language","languageFree","studyQuestionGuess","workerid"
12026,"88","I interrupt.",10,"The group decided to meet around 8pm. ",1,"023","I interrupted her stating, ""I will go get my manager,'' and walked away.","event_only","36","Thanks ","4","caucasian","male","eng",NA,"No clue",5
9213,"20","Couple run.",11,"We were the first ones to show up ",1,"177","A couple of months ago my husband and I were out running errands and decide to meet up with some friends at a local ""Mom & Pop'' restaurant.","event_only","36","Thanks ","4","caucasian","male","eng",NA,"No clue",5
18607,"86","I order.",12,"We all felt that we had ordered enough food for the whole group",1,"248","When it came time to pay she brings our ticket and explains that she rang us up for the pecan pie I had ordered as it was less expensive and what I wanted in the first place, but we noticed that she charged us for our friend's Taco Salad.","event_only","36","Thanks ","4","caucasian","male","eng",NA,"No clue",5
13827,"110","Dish hot.",13,"She decided to think it over before signing. ",1,"050","The dish was not hot and barely palatable; I believe he deliberately left it sitting before he brought it out as there were not enough other customers for the kitchen to be backed up.","event_only","36","Thanks ","4","caucasian","male","eng",NA,"No clue",5
64001,"18","Waiter say.",14,"A few of our guests had to leave early.",0,"271","The waiter said nothing the rest of the evening about us having to leave early, but he was clearly peeved.","event_only","36","Thanks ","4","caucasian","male","eng",NA,"No clue",5
18146,"41","We seat.",15,"A few of has that had been there before made suggestions. ",2,"120","We'd been seated at a booth, but I sat on a regular chair on the outside of the table -- yes, my crazy bubble rules apply to even family members --.","event_only","36","Thanks ","4","caucasian","male","eng",NA,"No clue",5
14107,"22","I order.",16,"We all look forward to getting together. ",0,"153","I ordered a fairly simple meal, and it was only when I opened my wallet that I suddenly realised I had forgotten to go to the bank.","event_only","36","Thanks ","4","caucasian","male","eng",NA,"No clue",5
14508,"29","It happen.",17,"The waitress brough a pitcher out from the bar. ",0,"171","It happened on a bank holiday and I was not at work that day.","event_only","36","Thanks ","4","caucasian","male","eng",NA,"No clue",5
152466,"11","We be.",1,"He asked his son a question, his son answered with a joke and then the parent told the son to behave, and realized that they blamed the son, even though he was kidding.",3,"191","We were out of things for him to do other than sing ""Old MacDonald'' to him, which probably wouldn't have gone over too well with the other patrons.","event_only","31","","3","white","female","eng",NA,"I honestly have no idea.",6
55658,"102","Salad deliver.",2,"They had a negative experience at a restaurant, which they informed the manager of.",5,"151","The salads with the dinners were delivered before the appetizer we ordered.","event_only","31","","3","white","female","eng",NA,"I honestly have no idea.",6
22322,"40","I have.",3,"The waitress offered them something while they were seated.",1,"086","I always had to speak up and try to get her attention for a refill.","event_only","31","","3","white","female","eng",NA,"I honestly have no idea.",6
25265,"18","I tip.",4,"They were going to leave, but the waiter offered them an incentive to stay, so they did.",2,"271","I usually tip well, but I gave the waiter 12%, which actually was too much.","event_only","31","","3","white","female","eng",NA,"I honestly have no idea.",6
22980,"86","I order.",5,"They placed an order and had to wait for what they felt was an unreasonable amount of time.",0,"248","After we ordered the waitress came back and apologized saying they were out of the pecan pie I had ordered.","event_only","31","","3","white","female","eng",NA,"I honestly have no idea.",6
18110,"29","It pour.",6,"Something they were anticipating, but weren't positive would happen, did.",1,"171","It was also pouring with rain outside and the restaurant was very busy with only about two tables free.","event_only","31","","3","white","female","eng",NA,"I honestly have no idea.",6
28672,"125","He stand.",7,"A child went with their parent to an auction, talked to his mother about what she wanted and then he placed a bid for her.",1,"120","He was standing next to me, but I did my best to concentrate on my soda and be polite.","event_only","31","","3","white","female","eng",NA,"I honestly have no idea.",6
59459,"68","He put.",8,"Someone threw something, which made the manager yell, and then the manager to explain what happened and assure a couple to stay.",3,"196","He put the box and the scale down on their table, and proceeded to pull raw steaks out of the box.","event_only","31","","3","white","female","eng",NA,"I honestly have no idea.",6
15009,"10","It be.",9,"The person had to commute outdoors in very cold weather.",0,"025","It was off to a bad start as soon as I walked in the door.","event_only","31","","3","white","female","eng",NA,"I honestly have no idea.",6
24313,"110","Dish hot.",10,"The person's wife retired, but he refused to and wondered why his wife chose to.",1,"050","The dish was not hot and barely palatable; I believe he deliberately left it sitting before he brought it out as there were not enough other customers for the kitchen to be backed up.","event_only","31","","3","white","female","eng",NA,"I honestly have no idea.",6
21651,"76","She break.",11,"She decided to break up with someone.",0,"033","Of course, she breaks the teabag inside.","event_only","31","","3","white","female","eng",NA,"I honestly have no idea.",6
24246,"88","He tell.",12,"There was an argument between a couple.",4,"023","He told her and her husband that he didn't appreciate their rude treatment of his staff, which happened every time they came in.","event_only","31","","3","white","female","eng",NA,"I honestly have no idea.",6
13043,"168","Husband decide.",13,"Someone did something embarrassing in public.",0,"177","My husband and I decided to just order a couple of sodas and desserts as we had a big breakfast earlier in the day and we explained to the waitress that our two orders would be on a separate ticket which seemed to confuse her.","event_only","31","","3","white","female","eng",NA,"I honestly have no idea.",6
15803,"84","Server start.",14,"Someone was impatient and wanted to the time to pass quickly.",1,"063","The server started arguing with my wife, ""I made sure the cook knew it had to be rare... the cook was going to leave it on longer but I made him take it off... etc.'' After a minute or so of listening to them argue about whether the burger was well done or rare, I just picked the burger patty up with both hands, they both stopped and looked at me, and I broke the burger patty in half with an audible snap.","event_only","31","","3","white","female","eng",NA,"I honestly have no idea.",6
28103,"78","You think.",15,"Someone was explaining what human beings, in general, allow others to do to them.",1,"022","If anyone should know better, you'd think it was him, except for his sense of entitlement.","event_only","31","","3","white","female","eng",NA,"I honestly have no idea.",6
17271,"22","It thing.",16,"Someone was placing an order at a restaurant.",1,"153","It was a good thing that they didn't prepare my meal before giving me the price!","event_only","31","","3","white","female","eng",NA,"I honestly have no idea.",6
22239,"21","Waitress come.",17,"Someone made a special request at a restaurant that the waitress had to check up on.",0,"243","After perusing our menus, the waitress came over to take our order.","event_only","31","","3","white","female","eng",NA,"I honestly have no idea.",6
136886,"29","It happen.",1,"It poured rain.",0,"171","It happened on a bank holiday and I was not at work that day.","event_only","23","","4","Asian","male","eng",NA,"I think this HIT was about sentence construction.",7
71760,"18","Waiter say.",2,"We remained in the restaurant to leave a tip.",0,"271","The waiter said nothing the rest of the evening about us having to leave early, but he was clearly peeved.","event_only","23","","4","Asian","male","eng",NA,"I think this HIT was about sentence construction.",7
84668,"47","He mention.",3,"The waiter comes quickly.",1,"025","At that point he also mentioned that the boss likes to sit at the booth I asked to sit in and that's why I couldn't sit there.","event_only","23","","4","Asian","male","eng",NA,"I think this HIT was about sentence construction.",7
92180,"47","He mention.",3,"The waiter comes quickly.",1,"025","At that point he also mentioned that the boss likes to sit at the booth I asked to sit in and that's why I couldn't sit there.","event_only","23","","4","Asian","male","eng",NA,"I think this HIT was about sentence construction.",7
101142,"47","He mention.",3,"Waiter come quick.",1,"025","At that point he also mentioned that the boss likes to sit at the booth I asked to sit in and that's why I couldn't sit there.","event_only","23","","4","Asian","male","eng",NA,"I think this HIT was about sentence construction.",7
33585,"125","He stand.",4,"The mum conversed with her friend.",1,"120","He was standing next to me, but I did my best to concentrate on my soda and be polite.","event_only","23","","4","Asian","male","eng",NA,"I think this HIT was about sentence construction.",7
14679,"11","Son behave.",5,"We blame the criminals.",4,"191","Our son was now behaving the way you would expect an 18-month-old to behave after sitting in a high chair for nearly an hour watching other people eat.","event_only","23","","4","Asian","male","eng",NA,"I think this HIT was about sentence construction.",7
56082,"21","Waitress come.",6,"Waitress looked at him.",0,"243","After perusing our menus, the waitress came over to take our order.","event_only","23","","4","Asian","male","eng",NA,"I think this HIT was about sentence construction.",7
18616,"48","Judge try.",7,"I am the manager.",1,"022","In reality this ""judge'' was trying to hide his martini on the floor.","event_only","23","","4","Asian","male","eng",NA,"I think this HIT was about sentence construction.",7
62996,"76","She break.",8,"She decide who wins.",0,"033","Of course, she breaks the teabag inside.","event_only","23","","4","Asian","male","eng",NA,"I think this HIT was about sentence construction.",7
8570,"40","Waitress offer.",9,"I have money.",0,"086","The waitress offered to refill my mother and brother's glasses, but she never asked if I needed one.","event_only","23","","4","Asian","male","eng",NA,"I think this HIT was about sentence construction.",7
12587,"84","Seconds come.",10,"Server start soon.",0,"063","A few seconds later the server came to check on us and asked how our food was.","event_only","23","","4","Asian","male","eng",NA,"I think this HIT was about sentence construction.",7
12767,"68","He throw.",11,"He put the headphones on.",5,"196","He then would throw that steak on the table, get another one out of the box, throw it on the scale, and again, exclaim:  ""10 ounces!''","event_only","23","","4","Asian","male","eng",NA,"I think this HIT was about sentence construction.",7
20558,"88","He tell.",12,"I go to the room.",5,"023","He told them they were no longer welcome.","event_only","23","","4","Asian","male","eng",NA,"I think this HIT was about sentence construction.",7
9647,"102","Salad deliver.",13,"We order two Cokes.",5,"151","The salads with the dinners were delivered before the appetizer we ordered.","event_only","23","","4","Asian","male","eng",NA,"I think this HIT was about sentence construction.",7
18599,"86","I order.",14,"I order a pizza.",0,"248","After we ordered the waitress came back and apologized saying they were out of the pecan pie I had ordered.","event_only","23","","4","Asian","male","eng",NA,"I think this HIT was about sentence construction.",7
21168,"110","Dish hot.",15,"I wonder who will win.",1,"050","The dish was not hot and barely palatable; I believe he deliberately left it sitting before he brought it out as there were not enough other customers for the kitchen to be backed up.","event_only","23","","4","Asian","male","eng",NA,"I think this HIT was about sentence construction.",7
91438,"20","Couple run.",16,"Mother go to bed.",1,"177","A couple of months ago my husband and I were out running errands and decide to meet up with some friends at a local ""Mom & Pop'' restaurant.","event_only","23","","4","Asian","male","eng",NA,"I think this HIT was about sentence construction.",7
34017,"22","It thing.",17,"I order a sandwich.",1,"153","It was a good thing that they didn't prepare my meal before giving me the price!","event_only","23","","4","Asian","male","eng",NA,"I think this HIT was about sentence construction.",7
76452,"110","I wonder, however, what we could have done differently to avoid his attitude.",1,"We just wanted a nice meal, but instead we have a terrible service.",3,"050","I wonder, however, what we could have done differently to avoid his attitude.","original","23","it was kinda long for the pay.","4","vietnamese","female","eng+other",NA,"filling in sentences",8
68421,"41","The food was good, the service was good, we had a fun time.",2,"The waiter came and seated us.",0,"243","The food was good, the service was good, we had a fun time.","original","23","it was kinda long for the pay.","4","vietnamese","female","eng+other",NA,"filling in sentences",8
18030,"78","If anyone should know better, you'd think it was him, except for his sense of entitlement.",3,"We ended up with a goodnight.",1,"022","If anyone should know better, you'd think it was him, except for his sense of entitlement.","original","23","it was kinda long for the pay.","4","vietnamese","female","eng+other",NA,"filling in sentences",8
20824,"76","Of course, she breaks the teabag inside.",4,"She has been talking on the phone all night.",0,"033","Of course, she breaks the teabag inside.","original","23","it was kinda long for the pay.","4","vietnamese","female","eng+other",NA,"filling in sentences",8
24512,"40","The waitress offered to refill my mother and brother's glasses, but she never asked if I needed one.",5,"I kept waiting but it took awhile to get the waiter's attention.",0,"086","The waitress offered to refill my mother and brother's glasses, but she never asked if I needed one.","original","23","it was kinda long for the pay.","4","vietnamese","female","eng+other",NA,"filling in sentences",8
28565,"84","The server started arguing with my wife, ""I made sure the cook knew it had to be rare... the cook was going to leave it on longer but I made him take it off... etc.'' After a minute or so of listening to them argue about whether the burger was well done or rare, I just picked the burger patty up with both hands, they both stopped and looked at me, and I broke the burger patty in half with an audible snap.",6,"I have been sitting there eating my food silently.",1,"063","The server started arguing with my wife, ""I made sure the cook knew it had to be rare... the cook was going to leave it on longer but I made him take it off... etc.'' After a minute or so of listening to them argue about whether the burger was well done or rare, I just picked the burger patty up with both hands, they both stopped and looked at me, and I broke the burger patty in half with an audible snap.","original","23","it was kinda long for the pay.","4","vietnamese","female","eng+other",NA,"filling in sentences",8
22754,"22","I ordered a fairly simple meal, and it was only when I opened my wallet that I suddenly realised I had forgotten to go to the bank.",7,"The price of the menu was absolutely ridiculous.",0,"153","I ordered a fairly simple meal, and it was only when I opened my wallet that I suddenly realised I had forgotten to go to the bank.","original","23","it was kinda long for the pay.","4","vietnamese","female","eng+other",NA,"filling in sentences",8
20040,"10","It's freezing this time of year so I didn't want to sit near the door.",8,"I can tell by the emptiness of the restaurant that it wouldn't be good.",1,"025","It's freezing this time of year so I didn't want to sit near the door.","original","23","it was kinda long for the pay.","4","vietnamese","female","eng+other",NA,"filling in sentences",8
15256,"62","At this point I'm just sticking around to watch the show.",9,"I looked on the table and I noticed a tissue.",0,"151","At this point I'm just sticking around to watch the show.","original","23","it was kinda long for the pay.","4","vietnamese","female","eng+other",NA,"filling in sentences",8
62385,"68","He put the box and the scale down on their table, and proceeded to pull raw steaks out of the box.",10,"The man asked the manager, how do they know for sure they were 10 oz.",3,"196","He put the box and the scale down on their table, and proceeded to pull raw steaks out of the box.","original","23","it was kinda long for the pay.","4","vietnamese","female","eng+other",NA,"filling in sentences",8
32097,"29","It happened on a bank holiday and I was not at work that day.",11,"I was walking outside and noticed a restaurant.",0,"171","It happened on a bank holiday and I was not at work that day.","original","23","it was kinda long for the pay.","4","vietnamese","female","eng+other",NA,"filling in sentences",8
39508,"41","The food was good, the service was good, we had a fun time.",12,"My family has gotten me to go to a restaurant.",0,"120","The food was good, the service was good, we had a fun time.","original","23","it was kinda long for the pay.","4","vietnamese","female","eng+other",NA,"filling in sentences",8
35546,"88","He told her and her husband that he didn't appreciate their rude treatment of his staff, which happened every time they came in.",13,"However the customers were still upset.",4,"023","He told her and her husband that he didn't appreciate their rude treatment of his staff, which happened every time they came in.","original","23","it was kinda long for the pay.","4","vietnamese","female","eng+other",NA,"filling in sentences",8
43289,"168","I was so embarrassed by the spectacle she made us into that I just wanted to leave.",14,"It may be strange to most people, but we like to keep track of our own food bills.",2,"177","I was so embarrassed by the spectacle she made us into that I just wanted to leave.","original","23","it was kinda long for the pay.","4","vietnamese","female","eng+other",NA,"filling in sentences",8
32314,"86","After we ordered the waitress came back and apologized saying they were out of the pecan pie I had ordered.",15,"I was waving to the waitress that we needed our bill.",0,"248","After we ordered the waitress came back and apologized saying they were out of the pecan pie I had ordered.","original","23","it was kinda long for the pay.","4","vietnamese","female","eng+other",NA,"filling in sentences",8
31104,"133","We waited some more, but only until we could snag our waiter, who was now quite a bit busier, since nearly an hour had passed and many more people had come in.",16,"We were all sitting there impatiently and upset that our food has not arrived.",0,"191","We waited some more, but only until we could snag our waiter, who was now quite a bit busier, since nearly an hour had passed and many more people had come in.","original","23","it was kinda long for the pay.","4","vietnamese","female","eng+other",NA,"filling in sentences",8
46042,"18","Just to spite him, we remained at our table for nearly 3 hours.",17,"This was the worse experience I ever had a restaurant.",1,"271","Just to spite him, we remained at our table for nearly 3 hours.","original","23","it was kinda long for the pay.","4","vietnamese","female","eng+other",NA,"filling in sentences",8
54710,"84","Seconds come.",1,"The web server was turned on.",0,"063","A few seconds later the server came to check on us and asked how our food was.","caveman","31","This took 10 minutes, way too long for $0.50, I had expected much better from your previous reputation.","4","white","female","eng",NA,"don't know",9
46018,"40","Waitress offer.",2,"Did you get an acceptance letter yet?",0,"086","The waitress offered to refill my mother and brother's glasses, but she never asked if I needed one.","caveman","31","This took 10 minutes, way too long for $0.50, I had expected much better from your previous reputation.","4","white","female","eng",NA,"don't know",9
39499,"102","We start on way.",3,"I asked to speak to a manager.",7,"151","We started on our way out of the restaurant.","caveman","31","This took 10 minutes, way too long for $0.50, I had expected much better from your previous reputation.","4","white","female","eng",NA,"don't know",9
34661,"48","Judge try in reality.",4,"I run this place.",1,"022","In reality this ""judge'' was trying to hide his martini on the floor.","caveman","31","This took 10 minutes, way too long for $0.50, I had expected much better from your previous reputation.","4","white","female","eng",NA,"don't know",9
16081,"41","Food good.",5,"We decided which restaurant to go to.",0,"243","The food was good, the service was good, we had a fun time.","caveman","31","This took 10 minutes, way too long for $0.50, I had expected much better from your previous reputation.","4","white","female","eng",NA,"don't know",9
23733,"18","Waiter say.",6,"We went to a restaurant with free WiFi.",0,"271","The waiter said nothing the rest of the evening about us having to leave early, but he was clearly peeved.","caveman","31","This took 10 minutes, way too long for $0.50, I had expected much better from your previous reputation.","4","white","female","eng",NA,"don't know",9
31026,"68","Manager shout after they.",7,"He leaves without paying.",6,"196","The manager shouted after them that they had not paid their bill, and the man shouted back something that I can't repeat on a family site.","caveman","31","This took 10 minutes, way too long for $0.50, I had expected much better from your previous reputation.","4","white","female","eng",NA,"don't know",9
14940,"88","I interrupt.",8,"He explains.",1,"023","I interrupted her stating, ""I will go get my manager,'' and walked away.","caveman","31","This took 10 minutes, way too long for $0.50, I had expected much better from your previous reputation.","4","white","female","eng",NA,"don't know",9
25143,"20","Couple run.",9,"They go to a restaurant.",1,"177","A couple of months ago my husband and I were out running errands and decide to meet up with some friends at a local ""Mom & Pop'' restaurant.","caveman","31","This took 10 minutes, way too long for $0.50, I had expected much better from your previous reputation.","4","white","female","eng",NA,"don't know",9
19398,"133","We wait.",10,"We wanted to win.",0,"191","We waited some more, but only until we could snag our waiter, who was now quite a bit busier, since nearly an hour had passed and many more people had come in.","caveman","31","This took 10 minutes, way too long for $0.50, I had expected much better from your previous reputation.","4","white","female","eng",NA,"don't know",9
13174,"47","He mention.",11,"They ate their meal.",1,"025","At that point he also mentioned that the boss likes to sit at the booth I asked to sit in and that's why I couldn't sit there.","caveman","31","This took 10 minutes, way too long for $0.50, I had expected much better from your previous reputation.","4","white","female","eng",NA,"don't know",9
15547,"41","Food good.",12,"We picked a restaurant.",0,"120","The food was good, the service was good, we had a fun time.","caveman","31","This took 10 minutes, way too long for $0.50, I had expected much better from your previous reputation.","4","white","female","eng",NA,"don't know",9
17309,"76","She break.",13,"She doesn't know what to do.",0,"033","Of course, she breaks the teabag inside.","caveman","31","This took 10 minutes, way too long for $0.50, I had expected much better from your previous reputation.","4","white","female","eng",NA,"don't know",9
20779,"22","I order.",14,"It was a mystery.",0,"153","I ordered a fairly simple meal, and it was only when I opened my wallet that I suddenly realised I had forgotten to go to the bank.","caveman","31","This took 10 minutes, way too long for $0.50, I had expected much better from your previous reputation.","4","white","female","eng",NA,"don't know",9
14047,"86","I order.",15,"The restaurant is very busy.",1,"248","When it came time to pay she brings our ticket and explains that she rang us up for the pecan pie I had ordered as it was less expensive and what I wanted in the first place, but we noticed that she charged us for our friend's Taco Salad.","caveman","31","This took 10 minutes, way too long for $0.50, I had expected much better from your previous reputation.","4","white","female","eng",NA,"don't know",9
17557,"110","Dish not hot.",16,"She wants us to buy an RV.",1,"050","The dish was not hot and barely palatable; I believe he deliberately left it sitting before he brought it out as there were not enough other customers for the kitchen to be backed up.","caveman","31","This took 10 minutes, way too long for $0.50, I had expected much better from your previous reputation.","4","white","female","eng",NA,"don't know",9
21749,"58","It freezing.",17,"I went to a restaurant.",0,"171","It's freezing this time of year so I didn't want to sit near the door.","caveman","31","This took 10 minutes, way too long for $0.50, I had expected much better from your previous reputation.","4","white","female","eng",NA,"don't know",9
77105,"76","She break.",1,"Where to go for dinner?As usual,",0,"033","Of course, she breaks the teabag inside.","event_only","33","","3","Wh","female","eng+other",NA,"Not sure",10
