"rt","chain","gloss","trialnum","response","clozeIndex","document","original","condition","age","comments","education","ethnicity","gender","language","languageFree","studyQuestionGuess","workerid"
8202,"10","It be.",4,"The dessert was served.",0,"025","It was off to a bad start as soon as I walked in the door.","caveman","26","None","4","Asian","male","eng",NA,"I don't know",20
12557,"102","We start on way.",5,"I asked for the manager.",7,"151","We started on our way out of the restaurant.","caveman","26","None","4","Asian","male","eng",NA,"I don't know",20
11158,"22","I order.",6,"I ordered a meal.",0,"153","I ordered a fairly simple meal, and it was only when I opened my wallet that I suddenly realised I had forgotten to go to the bank.","caveman","26","None","4","Asian","male","eng",NA,"I don't know",20
14902,"40","I have.",7,"I accepted her offer.",1,"086","I always had to speak up and try to get her attention for a refill.","caveman","26","None","4","Asian","male","eng",NA,"I don't know",20
16446,"78","We not allow.",8,"The waiter suggested an option.",0,"022","As I said, we did not allow it to tarnish our evening.","caveman","26","None","4","Asian","male","eng",NA,"I don't know",20
14707,"18","Waiter say.",9,"The service was horrible",0,"271","The waiter said nothing the rest of the evening about us having to leave early, but he was clearly peeved.","caveman","26","None","4","Asian","male","eng",NA,"I don't know",20
8050,"58","It freezing.",10,"I arrived at the restaurant.",0,"171","It's freezing this time of year so I didn't want to sit near the door.","caveman","26","None","4","Asian","male","eng",NA,"I don't know",20
26109,"110","I wonder.",11,"I complained to the manager",3,"050","I wonder, however, what we could have done differently to avoid his attitude.","caveman","26","None","4","Asian","male","eng",NA,"I don't know",20
18606,"11","We be.",12,"My son began to throw a tantrum",3,"191","We were out of things for him to do other than sing ""Old MacDonald'' to him, which probably wouldn't have gone over too well with the other patrons.","caveman","26","None","4","Asian","male","eng",NA,"I don't know",20
7732,"41","Food good.",13,"We arrived at the restaurant.",0,"243","The food was good, the service was good, we had a fun time.","caveman","26","None","4","Asian","male","eng",NA,"I don't know",20
18366,"41","Food good.",14,"We were greeted by the hostess",0,"120","The food was good, the service was good, we had a fun time.","caveman","26","None","4","Asian","male","eng",NA,"I don't know",20
8351,"168","I embarrassed.",15,"Everyone laughs at him.",2,"177","I was so embarrassed by the spectacle she made us into that I just wanted to leave.","caveman","26","None","4","Asian","male","eng",NA,"I don't know",20
11285,"68","He put on table.",16,"The man asks for the time.",3,"196","He put the box and the scale down on their table, and proceeded to pull raw steaks out of the box.","caveman","26","None","4","Asian","male","eng",NA,"I don't know",20
10174,"76","She break.",17,"We argued about what we would get.",0,"033","Of course, she breaks the teabag inside.","caveman","26","None","4","Asian","male","eng",NA,"I don't know",20
73959,"40","I always had to speak up and try to get her attention for a refill.",1,"when they were half full",1,"086","I always had to speak up and try to get her attention for a refill.","original","22","","4","Hispanic","female","eng",NA,"Creativity and interpretation of a context clues.",21
50473,"84","The server started arguing with my wife, ""I made sure the cook knew it had to be rare... the cook was going to leave it on longer but I made him take it off... etc.'' After a minute or so of listening to them argue about whether the burger was well done or rare, I just picked the burger patty up with both hands, they both stopped and looked at me, and I broke the burger patty in half with an audible snap.",2,"She came back and asked us about the meal.",1,"063","The server started arguing with my wife, ""I made sure the cook knew it had to be rare... the cook was going to leave it on longer but I made him take it off... etc.'' After a minute or so of listening to them argue about whether the burger was well done or rare, I just picked the burger patty up with both hands, they both stopped and looked at me, and I broke the burger patty in half with an audible snap.","original","22","","4","Hispanic","female","eng",NA,"Creativity and interpretation of a context clues.",21
37002,"62","At this point I'm just sticking around to watch the show.",3,"I found a snot rag in my salad.",0,"151","At this point I'm just sticking around to watch the show.","original","22","","4","Hispanic","female","eng",NA,"Creativity and interpretation of a context clues.",21
72148,"68","The manager shouted after them that they had not paid their bill, and the man shouted back something that I can't repeat on a family site.",4,"The man next to us thought they weren't giving him the full size of steak he ordered.",6,"196","The manager shouted after them that they had not paid their bill, and the man shouted back something that I can't repeat on a family site.","original","22","","4","Hispanic","female","eng",NA,"Creativity and interpretation of a context clues.",21
35552,"18","The waiter said nothing the rest of the evening about us having to leave early, but he was clearly peeved.",5,"We stayed at the table longer than normal and I tipped more than I should have.",0,"271","The waiter said nothing the rest of the evening about us having to leave early, but he was clearly peeved.","original","22","","4","Hispanic","female","eng",NA,"Creativity and interpretation of a context clues.",21
25059,"10","It was off to a bad start as soon as I walked in the door.",6,"It's so cold out now and the door is drafty.",0,"025","It was off to a bad start as soon as I walked in the door.","original","22","","4","Hispanic","female","eng",NA,"Creativity and interpretation of a context clues.",21
51481,"41","The food was good, the service was good, we had a fun time.",7,"We're friendly, but I'm shy.",0,"243","The food was good, the service was good, we had a fun time.","original","22","","4","Hispanic","female","eng",NA,"Creativity and interpretation of a context clues.",21
15430,"110","The dish was not hot and barely palatable; I believe he deliberately left it sitting before he brought it out as there were not enough other customers for the kitchen to be backed up.",8,"We are on a fixed income.",1,"050","The dish was not hot and barely palatable; I believe he deliberately left it sitting before he brought it out as there were not enough other customers for the kitchen to be backed up.","original","22","","4","Hispanic","female","eng",NA,"Creativity and interpretation of a context clues.",21
77463,"86","After we ordered the waitress came back and apologized saying they were out of the pecan pie I had ordered.",9,"The waitress made several mistakes on our order.",0,"248","After we ordered the waitress came back and apologized saying they were out of the pecan pie I had ordered.","original","22","","4","Hispanic","female","eng",NA,"Creativity and interpretation of a context clues.",21
78206,"88","I interrupted her stating, ""I will go get my manager,'' and walked away.",10,"They had brought coupons in that we didn't normally accept.",1,"023","I interrupted her stating, ""I will go get my manager,'' and walked away.","original","22","","4","Hispanic","female","eng",NA,"Creativity and interpretation of a context clues.",21
49814,"168","I was so embarrassed by the spectacle she made us into that I just wanted to leave.",11,"It's like they thought we were divorced.",2,"177","I was so embarrassed by the spectacle she made us into that I just wanted to leave.","original","22","","4","Hispanic","female","eng",NA,"Creativity and interpretation of a context clues.",21
14476,"78","If anyone should know better, you'd think it was him, except for his sense of entitlement.",12,"We made up for the evening later on.",1,"022","If anyone should know better, you'd think it was him, except for his sense of entitlement.","original","22","","4","Hispanic","female","eng",NA,"Creativity and interpretation of a context clues.",21
40020,"133","We waited some more, but only until we could snag our waiter, who was now quite a bit busier, since nearly an hour had passed and many more people had come in.",13,"It was hard to believe that they already had their food.",0,"191","We waited some more, but only until we could snag our waiter, who was now quite a bit busier, since nearly an hour had passed and many more people had come in.","original","22","","4","Hispanic","female","eng",NA,"Creativity and interpretation of a context clues.",21
60284,"76","Of course, she breaks the teabag inside.",14,"I looked at the rude woman on her cellphone as she held up the rest of the line.",0,"033","Of course, she breaks the teabag inside.","original","22","","4","Hispanic","female","eng",NA,"Creativity and interpretation of a context clues.",21
51554,"58","It's freezing this time of year so I didn't want to sit near the door.",15,"They told me that the booth was reserved and so I couldn't have it.",0,"171","It's freezing this time of year so I didn't want to sit near the door.","original","22","","4","Hispanic","female","eng",NA,"Creativity and interpretation of a context clues.",21
20225,"22","It was a good thing that they didn't prepare my meal before giving me the price!",16,"I had no idea how I was going to pay for the food.",1,"153","It was a good thing that they didn't prepare my meal before giving me the price!","original","22","","4","Hispanic","female","eng",NA,"Creativity and interpretation of a context clues.",21
36373,"41","The food was good, the service was good, we had a fun time.",17,"We decided to try the new restaurant with good reviews.",0,"120","The food was good, the service was good, we had a fun time.","original","22","","4","Hispanic","female","eng",NA,"Creativity and interpretation of a context clues.",21
38315,"68","Manager shout after they.",1,"Man leave.",6,"196","The manager shouted after them that they had not paid their bill, and the man shouted back something that I can't repeat on a family site.","caveman","21","This was fun! Thank you.","2","White","female","eng",NA,"To judge creativity.",22
16408,"41","Food good.",2,"We decide.",0,"120","The food was good, the service was good, we had a fun time.","caveman","21","This was fun! Thank you.","2","White","female","eng",NA,"To judge creativity.",22
11339,"86","I order.",3,"Group sit.",0,"248","After we ordered the waitress came back and apologized saying they were out of the pecan pie I had ordered.","caveman","21","This was fun! Thank you.","2","White","female","eng",NA,"To judge creativity.",22
11257,"88","I interrupt.",4,"I apologize.",1,"023","I interrupted her stating, ""I will go get my manager,'' and walked away.","caveman","21","This was fun! Thank you.","2","White","female","eng",NA,"To judge creativity.",22
20381,"11","Son behave.",5,"He make mistake.",4,"191","Our son was now behaving the way you would expect an 18-month-old to behave after sitting in a high chair for nearly an hour watching other people eat.","caveman","21","This was fun! Thank you.","2","White","female","eng",NA,"To judge creativity.",22
17370,"110","I wonder.",6,"I ask.",3,"050","I wonder, however, what we could have done differently to avoid his attitude.","caveman","21","This was fun! Thank you.","2","White","female","eng",NA,"To judge creativity.",22
6469,"78","You think.",7,"We leave.",1,"022","If anyone should know better, you'd think it was him, except for his sense of entitlement.","caveman","21","This was fun! Thank you.","2","White","female","eng",NA,"To judge creativity.",22
9712,"41","We people.",8,"We enter.",1,"243","We're amicable people, and enjoy small-talk with waiters... well, my mum and sister do, I'm hard of hearing so I'm generally quiet.","caveman","21","This was fun! Thank you.","2","White","female","eng",NA,"To judge creativity.",22
11652,"18","I tip.",9,"We leave.",2,"271","I usually tip well, but I gave the waiter 12%, which actually was too much.","caveman","21","This was fun! Thank you.","2","White","female","eng",NA,"To judge creativity.",22
5800,"168","Husband decide.",10,"I drop.",0,"177","My husband and I decided to just order a couple of sodas and desserts as we had a big breakfast earlier in the day and we explained to the waitress that our two orders would be on a separate ticket which seemed to confuse her.","caveman","21","This was fun! Thank you.","2","White","female","eng",NA,"To judge creativity.",22
13545,"22","I order.",11,"I see.",0,"153","I ordered a fairly simple meal, and it was only when I opened my wallet that I suddenly realised I had forgotten to go to the bank.","caveman","21","This was fun! Thank you.","2","White","female","eng",NA,"To judge creativity.",22
9189,"40","I have.",12,"I accept.",1,"086","I always had to speak up and try to get her attention for a refill.","caveman","21","This was fun! Thank you.","2","White","female","eng",NA,"To judge creativity.",22
6240,"84","Seconds come.",13,"I sit.",0,"063","A few seconds later the server came to check on us and asked how our food was.","caveman","21","This was fun! Thank you.","2","White","female","eng",NA,"To judge creativity.",22
23459,"102","Salad deliver before appetizer.",14,"Waiter ask.",5,"151","The salads with the dinners were delivered before the appetizer we ordered.","caveman","21","This was fun! Thank you.","2","White","female","eng",NA,"To judge creativity.",22
10299,"76","She break.",15,"He asks.",0,"033","Of course, she breaks the teabag inside.","caveman","21","This was fun! Thank you.","2","White","female","eng",NA,"To judge creativity.",22
6705,"29","It happen on holiday.",16,"We arrive.",0,"171","It happened on a bank holiday and I was not at work that day.","caveman","21","This was fun! Thank you.","2","White","female","eng",NA,"To judge creativity.",22
7733,"47","He mention.",17,"He ask.",1,"025","At that point he also mentioned that the boss likes to sit at the booth I asked to sit in and that's why I couldn't sit there.","caveman","21","This was fun! Thank you.","2","White","female","eng",NA,"To judge creativity.",22
55279,"68","Manager shout.",1,"The couple walked out of the restaurant.",6,"196","The manager shouted after them that they had not paid their bill, and the man shouted back something that I can't repeat on a family site.","event_only","30","Very interesting study!  I hope you find my work useful!","2","Caucasian","male","eng",NA,"Hmmm...  I think the HIT is about how people reason through information when they don't have enough details.",23
14873,"11","Son behave.",2,"We apologized for the problem.",4,"191","Our son was now behaving the way you would expect an 18-month-old to behave after sitting in a high chair for nearly an hour watching other people eat.","event_only","30","Very interesting study!  I hope you find my work useful!","2","Caucasian","male","eng",NA,"Hmmm...  I think the HIT is about how people reason through information when they don't have enough details.",23
106575,"84","Server start.",3,"We then worked on eating the food.",1,"063","The server started arguing with my wife, ""I made sure the cook knew it had to be rare... the cook was going to leave it on longer but I made him take it off... etc.'' After a minute or so of listening to them argue about whether the burger was well done or rare, I just picked the burger patty up with both hands, they both stopped and looked at me, and I broke the burger patty in half with an audible snap.","event_only","30","Very interesting study!  I hope you find my work useful!","2","Caucasian","male","eng",NA,"Hmmm...  I think the HIT is about how people reason through information when they don't have enough details.",23
9505,"47","He mention.",4,"He took our order.",1,"025","At that point he also mentioned that the boss likes to sit at the booth I asked to sit in and that's why I couldn't sit there.","event_only","30","Very interesting study!  I hope you find my work useful!","2","Caucasian","male","eng",NA,"Hmmm...  I think the HIT is about how people reason through information when they don't have enough details.",23
16222,"76","She decide.",5,"We apologized many times.",1,"033","At this point, she finally decides to get off the phone and gets huffy with the waitress about the ""defective teabag'' and how she needs to place her order ""right now because she's in a hurry.''","event_only","30","Very interesting study!  I hope you find my work useful!","2","Caucasian","male","eng",NA,"Hmmm...  I think the HIT is about how people reason through information when they don't have enough details.",23
6461,"78","We allow.",6,"We stood around.",0,"022","As I said, we did not allow it to tarnish our evening.","event_only","30","Very interesting study!  I hope you find my work useful!","2","Caucasian","male","eng",NA,"Hmmm...  I think the HIT is about how people reason through information when they don't have enough details.",23
15682,"110","Dish hot.",7,"I still need to work.",1,"050","The dish was not hot and barely palatable; I believe he deliberately left it sitting before he brought it out as there were not enough other customers for the kitchen to be backed up.","event_only","30","Very interesting study!  I hope you find my work useful!","2","Caucasian","male","eng",NA,"Hmmm...  I think the HIT is about how people reason through information when they don't have enough details.",23
5572,"18","We remain.",8,"We thank him.",1,"271","Just to spite him, we remained at our table for nearly 3 hours.","event_only","30","Very interesting study!  I hope you find my work useful!","2","Caucasian","male","eng",NA,"Hmmm...  I think the HIT is about how people reason through information when they don't have enough details.",23
71489,"86","I order.",9,"Other people order their food.",1,"248","When it came time to pay she brings our ticket and explains that she rang us up for the pecan pie I had ordered as it was less expensive and what I wanted in the first place, but we noticed that she charged us for our friend's Taco Salad.","event_only","30","Very interesting study!  I hope you find my work useful!","2","Caucasian","male","eng",NA,"Hmmm...  I think the HIT is about how people reason through information when they don't have enough details.",23
5914,"40","I have.",10,"We accept the offer.",1,"086","I always had to speak up and try to get her attention for a refill.","event_only","30","Very interesting study!  I hope you find my work useful!","2","Caucasian","male","eng",NA,"Hmmm...  I think the HIT is about how people reason through information when they don't have enough details.",23
18390,"41","Food good.",11,"We made reservations.",0,"243","The food was good, the service was good, we had a fun time.","event_only","30","Very interesting study!  I hope you find my work useful!","2","Caucasian","male","eng",NA,"Hmmm...  I think the HIT is about how people reason through information when they don't have enough details.",23
11785,"29","It pour.",12,"We were surprised.",1,"171","It was also pouring with rain outside and the restaurant was very busy with only about two tables free.","event_only","30","Very interesting study!  I hope you find my work useful!","2","Caucasian","male","eng",NA,"Hmmm...  I think the HIT is about how people reason through information when they don't have enough details.",23
7049,"41","We seat.",13,"We sat down.",2,"120","We'd been seated at a booth, but I sat on a regular chair on the outside of the table -- yes, my crazy bubble rules apply to even family members --.","event_only","30","Very interesting study!  I hope you find my work useful!","2","Caucasian","male","eng",NA,"Hmmm...  I think the HIT is about how people reason through information when they don't have enough details.",23
3833,"62","I stick.",14,"I pushed.",0,"151","At this point I'm just sticking around to watch the show.","event_only","30","Very interesting study!  I hope you find my work useful!","2","Caucasian","male","eng",NA,"Hmmm...  I think the HIT is about how people reason through information when they don't have enough details.",23
6723,"88","I interrupt.",15,"I apologized.",1,"023","I interrupted her stating, ""I will go get my manager,'' and walked away.","event_only","30","Very interesting study!  I hope you find my work useful!","2","Caucasian","male","eng",NA,"Hmmm...  I think the HIT is about how people reason through information when they don't have enough details.",23
15750,"22","I order.",16,"It worked.",0,"153","I ordered a fairly simple meal, and it was only when I opened my wallet that I suddenly realised I had forgotten to go to the bank.","event_only","30","Very interesting study!  I hope you find my work useful!","2","Caucasian","male","eng",NA,"Hmmm...  I think the HIT is about how people reason through information when they don't have enough details.",23
8037,"20","Couple run.",17,"Sister orders.",1,"177","A couple of months ago my husband and I were out running errands and decide to meet up with some friends at a local ""Mom & Pop'' restaurant.","event_only","30","Very interesting study!  I hope you find my work useful!","2","Caucasian","male","eng",NA,"Hmmm...  I think the HIT is about how people reason through information when they don't have enough details.",23
49560,"168","My husband and I decided to just order a couple of sodas and desserts as we had a big breakfast earlier in the day and we explained to the waitress that our two orders would be on a separate ticket which seemed to confuse her.",1,"My friend knocked over a dessert cart at a restaurant.",0,"177","My husband and I decided to just order a couple of sodas and desserts as we had a big breakfast earlier in the day and we explained to the waitress that our two orders would be on a separate ticket which seemed to confuse her.","original","41","It was much too lengthy for the pay.","4","white","female","eng",NA,"perception of comments",24
29188,"18","The waiter said nothing the rest of the evening about us having to leave early, but he was clearly peeved.",2,"Our waiter kept trying to rush us to finish our meals.",0,"271","The waiter said nothing the rest of the evening about us having to leave early, but he was clearly peeved.","original","41","It was much too lengthy for the pay.","4","white","female","eng",NA,"perception of comments",24
77259,"29","It happened on a bank holiday and I was not at work that day.",3,"I couldn't enjoy my meal, because of two screaming babies in the restaurant.",0,"171","It happened on a bank holiday and I was not at work that day.","original","41","It was much too lengthy for the pay.","4","white","female","eng",NA,"perception of comments",24
75581,"102","We started on our way out of the restaurant.",4,"We got up and headed for the door.",7,"151","We started on our way out of the restaurant.","original","41","It was much too lengthy for the pay.","4","white","female","eng",NA,"perception of comments",24
68949,"68","He put the box and the scale down on their table, and proceeded to pull raw steaks out of the box.",5,"The man got up, scoffed at the manager and walked towards the door.",3,"196","He put the box and the scale down on their table, and proceeded to pull raw steaks out of the box.","original","41","It was much too lengthy for the pay.","4","white","female","eng",NA,"perception of comments",24
36178,"40","The waitress offered to refill my mother and brother's glasses, but she never asked if I needed one.",6,"My waitress wasn't very attentive.",0,"086","The waitress offered to refill my mother and brother's glasses, but she never asked if I needed one.","original","41","It was much too lengthy for the pay.","4","white","female","eng",NA,"perception of comments",24
40798,"84","A few seconds later the server came to check on us and asked how our food was.",7,"My wife told the server that her steak was overcooked.",0,"063","A few seconds later the server came to check on us and asked how our food was.","original","41","It was much too lengthy for the pay.","4","white","female","eng",NA,"perception of comments",24
46783,"88","He told them they were no longer welcome.",8,"The couple were so disrespectful to me.",5,"023","He told them they were no longer welcome.","original","41","It was much too lengthy for the pay.","4","white","female","eng",NA,"perception of comments",24
33372,"125","He was standing next to me, but I did my best to concentrate on my soda and be polite.",9,"It seemed as though he was going to kiss my mum.",1,"120","He was standing next to me, but I did my best to concentrate on my soda and be polite.","original","41","It was much too lengthy for the pay.","4","white","female","eng",NA,"perception of comments",24
36843,"41","We're amicable people, and enjoy small-talk with waiters... well, my mum and sister do, I'm hard of hearing so I'm generally quiet.",10,"The restaurant seemed loud with all the people talking.",1,"243","We're amicable people, and enjoy small-talk with waiters... well, my mum and sister do, I'm hard of hearing so I'm generally quiet.","original","41","It was much too lengthy for the pay.","4","white","female","eng",NA,"perception of comments",24
35970,"86","After we ordered the waitress came back and apologized saying they were out of the pecan pie I had ordered.",11,"I'm never going to this restaurant again.",0,"248","After we ordered the waitress came back and apologized saying they were out of the pecan pie I had ordered.","original","41","It was much too lengthy for the pay.","4","white","female","eng",NA,"perception of comments",24
